{
  "seed": 42,
  "test_mode": true,
  "tasks": [],
  "generators": [
    {
      "datasets": [
        {
          "dataset": "hotpot_train",
          "datasets": {
            "train": { "loader": "hotpot", "split": "train", "count": 10, "dataset_name": "hotpot_train_sample" },
            "validation": { "loader": "hotpot", "split": "validation", "count": 5, "dataset_name": "hotpot_validation_sample" },
            "test": { "loader": "hotpot", "split": "test", "count": 5, "dataset_name": "hotpot_test_sample" }
          }
        }
      ],
      "optimizers": [
        { "name": "few_shot", "optimizer_prompt_params": { "max_trials": 2, "n_samples": 1 } },
        { "name": "evolutionary_optimizer", "optimizer_prompt_params": { "max_trials": 2, "population_size": 3, "num_generations": 1 } },
        {
          "name": "gepa",
          "optimizer_prompt_params": {
            "max_trials": 2,
            "n_samples": 1,
            "reflection_minibatch_size": 1,
            "candidate_selection_strategy": "pareto",
            "skip_perfect_score": false
          }
        },
        { "name": "hierarchical_reflective", "optimizer_prompt_params": { "max_trials": 2 } },
        { "name": "meta_prompt", "optimizer_prompt_params": { "max_trials": 2 } }
      ],
      "models": [
        { "name": "openai/gpt-4.1-mini", "model_parameters": { "temperature": 1.0 } }
      ],
      "metrics": [
        { "path": "benchmarks.metrics.hotpot.hotpot_f1" }
      ],
      "prompt": [
        { "role": "system", "content": "Answer the question based on the given context." },
        { "role": "user", "content": "{question}" }
      ]
    },
    {
      "datasets": [
        {
          "dataset": "hover_train",
          "datasets": {
            "train": { "loader": "hover", "split": "train", "count": 10, "dataset_name": "hover_train_sample" },
            "validation": { "loader": "hover", "split": "validation", "count": 5, "dataset_name": "hover_validation_sample" },
            "test": { "loader": "hover", "split": "test", "count": 5, "dataset_name": "hover_test_sample" }
          }
        }
      ],
      "optimizers": [
        { "name": "few_shot", "optimizer_prompt_params": { "max_trials": 2, "n_samples": 1 } },
        { "name": "evolutionary_optimizer", "optimizer_prompt_params": { "max_trials": 2, "population_size": 3, "num_generations": 1 } },
        { "name": "gepa", "optimizer_prompt_params": { "max_trials": 2, "n_samples": 1 } },
        { "name": "hierarchical_reflective", "optimizer_prompt_params": { "max_trials": 2 } },
        { "name": "meta_prompt", "optimizer_prompt_params": { "max_trials": 2 } }
      ],
      "models": [
        { "name": "openai/gpt-4.1-mini", "model_parameters": { "temperature": 1.0 } }
      ],
      "metrics": [
        { "path": "benchmarks.metrics.hover.hover_label_accuracy" }
      ],
      "prompt": [
        { "role": "system", "content": "Classify the claim based on the given context and provide a concise answer." },
        { "role": "user", "content": "{claim}" }
      ]
    },
    {
      "datasets": [
        {
          "dataset": "pupa_train",
          "datasets": {
            "train": { "loader": "pupa", "split": "train", "count": 10, "dataset_name": "pupa_train_sample" },
            "validation": { "loader": "pupa", "split": "validation", "count": 5, "dataset_name": "pupa_validation_sample" },
            "test": { "loader": "pupa", "split": "test", "count": 5, "dataset_name": "pupa_test_sample" }
          }
        }
      ],
      "optimizers": [
        { "name": "few_shot", "optimizer_prompt_params": { "max_trials": 2, "n_samples": 1 } },
        { "name": "evolutionary_optimizer", "optimizer_prompt_params": { "max_trials": 2, "population_size": 3, "num_generations": 1 } },
        { "name": "gepa", "optimizer_prompt_params": { "max_trials": 2, "n_samples": 1 } },
        { "name": "hierarchical_reflective", "optimizer_prompt_params": { "max_trials": 2 } },
        { "name": "meta_prompt", "optimizer_prompt_params": { "max_trials": 2 } }
      ],
      "models": [
        { "name": "openai/gpt-4.1-mini", "model_parameters": { "temperature": 1.0 } }
      ],
      "metrics": [
        { "path": "benchmarks.metrics.pupa.pupa_quality_judge" },
        { "path": "benchmarks.metrics.pupa.pupa_leakage_ratio" }
      ],
      "prompt": [
        { "role": "system", "content": "Rewrite or answer while avoiding any PII leakage; be concise and respect redaction constraints." },
        { "role": "user", "content": "{question}" }
      ]
    }
  ]
}
